[objekt] används för att starta vattenposten | [objekt] is used to start the hydrant
det finns [x] rum anpassade för gäster med svårt att röra sig | there is/are [x] rooms adapted for guests with mobility issues
det finns en nivåskillnad på [m] för nå avskilda åskådarutrymmen | there is a level difference of [m] to reach separate audience spaces
det finns en orienteringsskylt vid trappans slut [x] | there is an orientation map at the end of the stairs [x]
det finns möjlighet att [v] hjälpmedel | there are opportunities to [v] aids
det finns utskjutande föremål i trappan [x] | there are protruding objects in the staircase [x]
det fria utrymmet framför monitorn är [b] | the space in front of the monitor is [b]
det högra armstödets höjd är [m] | the height of the right armrest is [m]
det högre nödlarmet på väggen är placerat [m] från golv | the higher emergency alarm on the wall is placed [m] from the floor
det högst placerade låset finns [m] från golvet | the highest placed lock is [m] above the floor
det lägst placerade låset finns [m] från golvet | the lowest placed lock is [m] above the floor
det längsta avståndet mellan två sittplatser är [b] | the longest distance between two seats is [b]
det utskjutande föremålet har [m] i kontrast nedtill | the protruding object has a contrast of [m] at the bottom
det utskjutande föremålet har [m] i kontrast upptill | the protruding object has [m] at the top
det utskjutande föremålet har en fri höjd på [m] | the protruding object has a free height of [m]
det vänstra armstödets höjd är [m] | the height of the left armrest is [m]
det är [m] fri bredd på balkongen | the free width of the balcony is [m]
det är [m] fri höjd under det utskjutande föremålet | there is [m] of free space under the protruding object
det är [x] med pälsdjur i rummet | it is [x] to have furred animals in the room
det är [m] mellan karuselldörr och dörr intill | it is [m] between the revolving door and the door next to it
det är [m] mellan ledstången och väggen | it is [m] between the handrail and the wall
det är [m] mellan väggen och ledstången | it is [m] between the handrail and the wall
det är [nu] steg till vilplan | there is [nu] steps to the resting level
det är [nu] trappsteg till vilplan | there is [nu] steps to the resting level
diametern på den fria vändytan är [b] | the diameter on the free turning space is [b]
digital guide [finns] för teckentolkning | digital guide is [finns] for sign interpretation
digital guide för syntolkning [finns] | digital guide for sight interpretation are [finns]
diplomering [finns] | diploma is [finns]
diskens ljushetskontrast mot bakgrund är [m] | the brightness contrast of the counter against the background is [m]
diskhon har [objekt] | the sink has [objekt]
diskhons arbetshöjd är [m] | the reachable height of the sink is [m]
diskmaskinens reglage har ljushetskontrast [m] mot bakgrund | the dishwasher controls have a lightness contrast of [m] against background
djupet på det fria benutrymmet är [m] | the depth of the leg room is [m]
djupet på hisskorgen är [m] | the lift car is [m] deep
djupet på utrymmet under bordet är [m] | the free legroom under the table is [m] deep
djupet på utrymmet under skötbordet är [m] | the free legroom under the changing table is [m] deep
djupmarkeringens ljushetskontrast är [m] | the lightness contrast of the depth marking is [m]
doftblock eller liknande som avger doft [finns] | air freshener or similar which gives off scent are [finns]
doftblock , doftljus eller annan typ av rumsdoft [finns] | air freshener, scented candles, or other types of room scent are [finns]
draghandtaget är placerat [p] | the pulling handle is [p]
draghandtaget är placerat [m] över golv | the pulling handle is placed [m] above the floor
dusch [finns] som kan användas som handdusch | shower [finns] which can be used as a hand showe
duschen är placerad i [objekt] | the shower is placed in the [objekt]
duschplats som avgränsas med mjuk list [finns] | shower area surrounded by soft ledge is [finns]
duschstol [finns] | shower chair is [finns]
dygnsmedelvärde magnetfältsstyrka är [b] | the 24 hour average value strength of the electricity field is [b]
dörr intill karuselldörr [finns] | the door near the revolving door [finns]
dörr intill vändkors [finns] | the door next to turnstile [finns]
dörr som kan låsas upp utifrån utan speciellt redskap eller nyckel vid nödlarm [finns] | door that can be unlocked from the outside without a special tool or key in case of emergency is [finns]
dörr som öppnas ut i gångstråk [finns] | door which opens out into a pedestrian path is [finns]
dörr till isen [x] som öppnas med en handrörelse | door to the ice [x] which is opened by one hand motion
dörrbladet har en ljushetskontrast på [m] mot dörrkarmen | the door surface has a lightness contrast of [m] against the door frame.
dörrhandtaget är placerat [m] från närmaste hinder | the door handle is placed [m] from the nearest obstacle
dörrhandtaget är placerat [m] från närmsta hinder | the door handle is placed [m] from the nearest obstacle
dörrkarmen har en ljushetskontrast på [m] mot omgivande vägg | the door frame has a lightness contrast of [m] against surrounding wall
dörrlåset är [b] | the door lock is [b]
dörrmattan är [b] | the doormat is [b]
dörrstängare [finns] | door closer is [finns]
dörrstängare [finns] på dörren | door closer [finns] on the door
dörröppningens fria bredd är [m] | the width of the door opening is [m]
dörröppningens fria höjd är [m] | clear height of the door opening is [m]
e-faktura [finns] | e-bill [finns]
eluttag placerat vid arbetsbänkens framkant [finns] | an electric socket is [finns] at the front edge of the work surface
eluttaget är placerat [m] från golvet | the socket is placed [m] from the floor
endast parfymfri tvål [finns] | only soap with no perfume is [finns]
enstaka trappsteg med avvikande höjd [x] | occasional steps of different heights [x]
evenemang som är textbaserat [x] | text-based event are [x]
flaggans ljushetskontrast mot omgivning är [b] | the lightness contrast of the flag against the surroundings is [b]
fri bredd framför automat är [m] | the free turning space in front of the machine is [m] wide
fri bredd framför telefonen är [m] | the free turning space in front of the telephone is [m] wide
fri bredd under bordet är [m] | the free legroom under the table is [m] wide
fri höjd under arbetsbänk är [m] | the height of the space under the work surface is [m]
fri höjd under bordet är [m] | the height of the free space under the table is [m]
fri höjd under disken är [m] | free height under the counter is [m]
fri höjd under diskho är [m] | the free height of the space under the sink is [m]
fri höjd under skötbordet är [m] | the height of the free space under the baby changing table is [m]
fri höjd under spishäll är [m] | the height of the space under the hob is [m]
fri längd framför automat är [m] | the length of the free turning space in front of the machine is [m]
fri längd framför ljusbärare är [m] | length in front of light carrier is [m]
fri längd framför telefonen är [m] | the free turning space is [m] long
fri sikt vid räcke finns från höjden [x] | an unobstructed view at the rail is available above the height of [x]
fri sikt vid räcke finns upp till höjden [m] | an unobstructed view is available at the rail up to the height of [m]
fria vändytans underlag är [x] | surface of free turning space is [x]
fribärande trappa har [objekt] ljushetskontrast upptill | the unsupported staircase has - brightness contrast at the top [objekt]
fritt djup för ben under arbetsbänk är [b] | the space under the work surface is [b] deep
fritt djup för ben under diskho är [b] | the free space for legs under the sink is [b] deep
fritt djup för ben under spishäll är [b] | the depth of the space under the hob is [b]
från första till andra sittplatsen på gångvägen är det [finns] | the distance from one seat to the next is [finns]
funktion [finns] som är lättmanövrerad | function that is easily manoeuvered is [finns]
funktion för att få vatten [finns] som kan användas med bara en hand | a function to get water is [finns] that can be used with only one hand
funktion som inte behöver vridas [finns] | a function that does not need to be turned is [finns]
funktion som inte måste vridas [finns] | a function that does not need to be turned is [finns]
funktionen att nå för att hämta vatten finns [m] över underlaget | the function for getting water is placed [m] above the ground
funktionen är placerad [m] över underlag | the function is placed [m] above the ground
funktionens ljushetskontrast är [b] mot bakgrunden | the lightness contrast of the function is [b] against its background
funktionens typ är [b] | the type of function is [b]
funktioner har ljushetskontrast [m] mot bakgrund | the lightness contrast of the functions is [m] against their background
funktioner markerade med rött och grönt [finns] på automaten | functions marked in red and green are [finns] on the machine
färden med rulltrappan tar [t] | the ride on the escalator takes [t]
för anrop krävs [nu] knapptryckningar | to call [nu] pressings of buttons are needed
förankringen på rampen är [b] | the anchoring of the ramp is [b]
föremål som är väl belysta [finns] | items that are well lit [finns]
föremålets markering är [b] | the marking is [b]
förvaringsboxens bredd är [m] | the width of the storage box is [m]
förvaringsboxens djup är [m] | the depth of the storage box is [m]
gavelns ljushetskontrast mot bakgrunden är [m] | the lightness contrast of the side is [m] against the background
giftiga växter intill eller på lekplatsen [finns] | poisonous plants are [finns] in or near the playground
glasytan har en markering med en ljushetskontrast på [m] | the glass surface has a marking with a lightness contrast of [m] against the background
glipan mellan brygga och ramp är [m] | the gap between the jetty and the ramp is [m]
glipan mellan brädorna är [m] | the gaps between the boards are [m]
glipor mellan brädor är [m] | the gaps between the boards are [m]
greppvänliga handtag på lådor och skåp [finns] | handles on drawers and cabinets easy to grasp [finns]
greppvänligt armstöd [finns] | a grippy armrest is [finns]
grillbädden är [m] från underlag | the barbecue bed is [m] from the ground
grind intill vändkorset [finns] | gate near the turnstile is [finns]
grinden har ljushetskontrast [m] mot omgivande ytor | the gate has a lightness contrast of [m] against surrounding surfaces
grindens passagemått är [m] | the opening of the gate is [m] wide
grindlås [finns] | gate lock is [finns]
gunga anpassad för rullstol [finns] | swing adapted for wheelchair is [finns]
gångmattan är [b] | the runner is [b]
gångvägen lutar som mest [m] i längsled | the pedestrian area tilt is [m]
gångvägen lutar som mest [m] i sidled | the pedestrian area tilts [m] sideways
gångvägen är på det smalaste stället [m] bred | the width of the pedestrian path is [m]
gångvägen är totalt [m] lång | the pedestrian area is [m]
gångvägens bredd är [m] | the width of the pedestrian path is [m]
gångvägens underlag är [b] | the surface of the pedestrian path is [b]
gångvägens underlag är av [n] | the surface of the pedestrian path is [n]
gångvägens yta fram till bryggan är [b] | the area of the path to the jetty is [b]
gångvägens yta fram till vattnet är [b] | the area of the path to water is [b]
gångytan lutar [c] i sidled | the pedestrian area tilts [c] sideways
gångytan längslutning är [c] | the pedestrian area tilt is [c]
gångytan är [b] | the pedestrian area is [b]
gångytan är [m] lång | walking path length is [m]
gångytans bredd är [m] | the walking area is [m] wide
gångytor finns till [objekt] | walking area to [objekt]
gångytor till lekredskap [finns] | there [finns] ways for playground equipment
gångytor är [b] | the walking area is [b]
handfatet har [objekt] | the basin has [objekt]
handfatet har ljushetskontrast [m] mot bakgrunden | the basin has a brightness cotrast of [m] against the background
handikapparkeringsplatsen lutar i längsled [c] | the lengthways tilt of the disabled parking space is [c]
handikapparkeringsplatsen är [m] lång | the disabled parking space is [m] long
handikapparkeringsplatsen är markerad med [objekt] | the disabled parking space is marked by [objekt]
handikapptoalett [finns] som kan nås med rullstol | disabled toilet is [finns] that can be reached in a wheelchair
handtagets ljushetskontrast är [m] mot bakgrund | the brightness contrast of the handle is [m] against background
handtagsfäste för rullstol på kundvagn [finns] | handle attachment for wheelchair on shopping trolley is [finns]
heltäckande textilmatta [finns] | wall-to-wall textile carpet are [finns]
hiss som öppnas ut mot nedåtgående trappa [finns] | lift that opens out onto a descending staircase is [finns]
hissknapp [finns] som behöver hållas intryckt under hela färden | lift button [finns] which needs to be held in for the duration of the ride
hissknapparna har [objekt] som kännbar markering | the lift buttons have [objekt] as a tactile marking
hissknapparna är [m] stora | the lift buttons are [m] large
hissknappen är [b] | the lift button is [b]
hisskorgens bredd är [m] | the lift car is [m] wide
hjälpmedel för aktivitet [finns] på plats | activity aids [finns] on-site
husvägg eller motsvarande [finns] som ersätter avåkningsskydd på höger sida | wall or similar are [finns] which substitutes guard on the right hand side
hyllmärkningen [aer] konsekvent placerad | consistently placed shelf marking is [aer]
hänvisning till servicebrygga eller liknande [finns] | directions to service jetty or similar are [finns]
hållplatsen lutar [c] i längsled | the surface at the stop tilts [c] lengthways
hållplatsens yta är [m] | the surface at the stop is [m]
hållplatsytan [aer] jämn | stop area [aer] even
hållplatsytan lutar [c] i sidled | the stop surface tilts [c] sideways
hållplatsytan är [m] bred där den främre fordonsdörren finns när fordonet har stannat vid hållplatsen | the area at the stop is [m] wide near where the front door of the vehicle is when at the stop.
höger armstöd är [b] | armrest is [b]
högra handledarens höjd är [m] | the height of the handrail on the right is [m]
högra ledstångens kontrast är [m] mot bakgrund | the lightness contrast of the right handrail is [m] against the background
högsta arbetshöjd på upphöjd diskho är [m] | the highest reachable height of a raised sink is [m]
högsta del på stödhandtag är placerat [m] från underlag | the highest part of the grab rail is placed [m] from the ground
högsta fria höjd under diskhon är [m] | the highest free height under the sink is [m]
högsta fria höjd under spishällen är [m] | the highest height of space under the hob is [m]
högsta funktion är placerad [m] från underlaget | the highest function is placed [m] above the ground
högsta hyllan är placerad [m] från underlag | the highest shelf is placed [m] from the ground
högsta höjd på det höj- och sänkbara bordet är [m] | the highest height of the adjustable table is [m]
högsta höjd på handtag på rullstolsanpassad kundvagn är [m] | the highest height of handle on the wheelchair adapted shopping trolley is [m]
högsta höjd på höj- och sänkbar spishäll är [m] | the highest height of the adjustable hob is [m]
högsta höjd på korgsidor på rullstolsanpassad kundvagn är [m] | the highest height of the basket sides of the wheelchair adapted trolley is [m]
högsta höjd på lekredskap är [m] | highest height of playground equipment is [m]
högsta höjd på nedre delen av föremål i monter eller liknande är [m] | the highest height of the lower part of objects in display cases or similar is [m]
högsta höjd på upphöjd arbetsbänk är [m] | the highest possible height of a raised work surface is [m]
högsta höjd på upphöjd behandlingsbänk är [m] | the highest height of a raised treatment bench is [m]
högsta höjd på upphöjd brits är [m] | the highest height of the raised gurney is [m]
högsta höjd på upphöjd säng är [m] | the highest height of a raised bed is [m]
högsta höjden på den höj- och sänkbara disken [m] | maximum height of the height-adjustable desk [m]
högsta höjden på disken är [m] | the highest height of the counter is [m]
högsta höjden på kortläsaren är [m] | the highest height of the card reader is [m]
högsta placering av hinkar är [m] | highest height of buckets is [m]
högsta placering av teknisk funktion är [m] . | the highest height of technical function is [m]
högsta placering på funktioner är [m] | the highest height of functions is [m]
högsta sitthöjd på stol är [m] | the highest seating height is [m]
högsta sitthöjd är [m] | the highest seating height is [m]
högtalarinformation med god ljudkvalitet [finns] | loudspeaker information of good sound quality is [finns]
höjd på barnpall [m] | the height of the stool for children is [m]
höjd på kant till podium är [m] | the height of the podium edge is [m]
höjden på det lägre nödlarmet på väggen är [m] | the lower emergency alarm on the wall is placed [m] from the floor
höjden på disken är [m] | the height of the counter is [m]
höjden på högst placerade ljus är [m] | the height of the highest placed lights is [m]
höjden på högsta delen av disken [m] | height at the highest part of the counter [m]
höjden på lägst placerade ljus är [m] | the height of the lowest placed lights is [m]
höjdskillnad till avfasning av kanten vid rulltrappans början är [m] | the height difference to the bevelling of the edge near the beginning of the escalator is [m]
höjdskillnad till avfasning av kanten vid rulltrappans slut är [m] | the height difference to the bevelling of the edge at the end of the escalator is [m]
höjdskillnad till avfasning är [m] | the height difference to the bevelling is [m]
höjdskillnaden till avfasningen är [m] | the height difference to the bevelling is [m]
hörselteknisk utrustning [finns] | audio technical equipment is [finns]
hörselteknisk utrustning [finns] i lokalen | hearing aid equipment is [finns] in the room or area
hörselteknisk utrustning som innefattar podiet [finns] | audio technology equipment that includes the podium [finns]
hörselteknisk utrustning vid guidning eller visning används [x] | audio equipment when guiding or showing [x]
hörselteknisk utrustning är [b] | audio technical equipment is [b]
information finns på punktskrift | information is available in braille
information om vad varorna innehåller [finns] | information about what the products contain is [finns]
information på lättläst svenska [finns] | information in easy to read swedish [finns]
informationen är [b] | the information is [b]
informationstavlans knapp har [objekt] | the button of the information board has [objekt]
instruktion för ugn på punktskrift [finns] | oven instructions in braille [finns]
instruktion som det går att komma nära intill [finns] som komplement till högt placerad instruktion | instruction that is easy to get close to is [finns] as a complement to instruction placed high up
instruktion som går att komma nära intill [finns] som komplement till högt placerad instruktion | instruction that is easy to get close to is [finns] as a complement to instruction placed high up
instruktionen finns som [x] | the instructions are available as [x]
instruktionen är [b] | the instructions are [b]
instruktionens bakgrund är [b] | the background to the instruction is [b]
instruktionens högsta placering på automaten är [m] över underlaget | the highest instruction is placed [m] above ground
instruktionens högsta placering är [m] över underlaget | the highest instruction is placed [m] above the ground
instruktionens ljushetskontrast är [m] mot bakgrunden | the lightness contrast of the instruction is [m] against the background
instruktionens lägsta placering på automaten är [m] över underlaget | the lowest instruction is placed [m] above the ground
instruktionens lägsta placering är [m] över underlaget | the lowest instruction is placed [m] above the ground.
instruktionens textstorlek är [m] | the text size of the instruction is [m]
instruktionens typ av text är [objekt] | the text type for the instructions is [objekt]
instruktioner för mikrovågsugnen på lättläst svenska [finns] | instructions for microwave in easy to read swedish are [finns]
instruktioner för mikrovågsugnen på punktskrift [finns] | instructions for microwave oven in braille are [finns]
instruktioner för tvättmaskin på lättläst svenska [finns] | instructions for washing machine in easy to read swedish [finns]
instruktioner för tvättmaskin på punktskrift [finns] | instructions for washing machine in braille [finns]
instruktionerna har ljushetskontrast [m] | the instructions have a lightness contrast of [m]
instruktionerna är på [l] | the instructions are in [l]
kantstenens höjd är [m] | the height of the kerb stone is [m]
kanten vid rulltrappans början är [m] hög | the edge at the beginning of the escalator is [m] high
kantens avfasning lutar [c] | the bevelling of the edge has an angle of [c]
kantens höjd är [m] | the edge is [m] high
kantstenen vid hållplatsen är [m] hög | the kerb near the stop is [m] high
karta [finns] | map are [finns]
karta över området [finns] | guidmap for bohus fortress is [finns]
karusell [finns] som är anpassad för rullstol | roundabout adapted for wheelchair is [finns]
kassans höjd är [m] från underlaget | the height of the check-out is [m] above the ground
kassapriset är placerat [m] från underlaget | the check-out price is placed [m] from the surface
klädskåpet är placerat [m] från närmaste hörn | the clothes cupboard is placed [m] from the nearest corner
klädskåpets bredd är [m] | the width of the clothes cupboard is [m]
klädskåpets djup är [m] | the depth of the clothes cupboard is [m]
klädstången är placerad [m] från golvet | the clothes bar is placed [m] above the floor
klättring med olika svårighetsgrad [finns] | climbing with different severity is [finns]
knapp för talad information är placerad [m] om skylt | button for spoken information is placed [m] of sign
knapp är [b] | the type of buttons is [b]
knapparna är [m] i diameter | the buttons have a diameter of [m]
knapparnas diameter är [m] | the buttons have a diameter of [m]
knapparnas markering är [b] | the marking of the buttons is in [b]
knappen är en [n] | the type of buttons is [n]
knappen är placerad [m] från underlaget | the button is placed [m] from the ground
knappens ljushetskontrast mot bakgrund [m] | button’s brightness contrast against background [m]
knappens utformning : [x] | the design of the button [x]
knappsatsens ljushetskontrast är [m] | the brightness contrast of the keypad is [m]
knappsatsens ljushetskontrast är [m] mot bakgrunden | the lightness contrast of the keypad is [m] against its background
kantstenens ljushetskontrast är [m] | the brightness contrast of the kerb stone is [m]
knutpunkten är [b] att hitta | the meeting point is [b] to find
kommunikationshjälpmedel [finns] | aids for communication are [finns]
konsekvent placering av alla funktioner [finns] | consequently placed functions is [finns]
kontrastmarkering alla steg [finns] | contrast marking all steps are [finns]
kontrastmarkering alla trappsteg [finns] | contrast marking all steps are [finns]
korsningens markering har en ljushetskontrast på [m] mot bakgrunden | the marking of the crossing has a brightness contrast of [m] against the background
kortaste avstånd till lift är [m] | the shortest distance between the area for boarding and alighting, and the lift, is [m]
kortaste avståndet mellan knappar är [m] | the shortest distance between buttons is [m]
krok är placerad [m] från klädskåpets golv | the hook is placed [m] from the floor of the clothes cupboard
kroken har höjden [m] | the hook has the height [m]
kroken är placerad [m] från hörn | the hook is placed [m] from corner
kuddar och dynor av polyester [finns] | pillows and cushions made of polyester are [finns]
kundpåsarna är placerade på höjden [m] | the height at which the customer bags are placed is [m]
kundvågens höjd är [m] | the height of the customer scales is [m]
kyl är placerad [m] från närmaste hörn | the fridge is placed [m] from the nearest corner
kännbar markering [finns] på alla reglage på diskmaskinen | tactile markings are [finns] on all dishwasher controls
kännbar markering [finns] på knapp för nödlarm | tactile marking on button for emergency alarm is [finns]
kännbar markering på alla reglage på mikrovågsugnen [finns] | tactile markings on all microwave oven controls are [finns]
kännbart ledstråk [finns] | tactile trail is [finns]
kännbart ledstråk [x] till påstigningsplatsen | tactile trail is [x] to the place for boarding
kännbart ledstråk [x] utmed hållplatsytan | tactile trail is [x] alongside the stop area.
kännbart markerade anropsknappar [finns] | tactily marked call buttons are [finns]
kännbart markerade reglage på ugn [finns] | tactily marked oven controls [finns]
kösystem [finns] som anger könummer akustiskt | queuing system [finns] that indicates numbers acoustically (by audio)
kösystemet är [b] | the queuing system is [b]
landgångsbryggans bredd är [m] | the gangway is [m] wide
larminstruktion på engelska [finns] | emergency instructions in english are [finns]
larminstruktion på lättbegriplig svenska [finns] | alarm instructions in easy to understand swedish are [finns]
