[objekt] används för att starta vattenposten | [objekt] is used to start the hydrant
larminstruktion på punktskrift [finns] | alarm instructions in braille are [finns]
larminstruktion som bildsymbol [finns] | alarm instructions as picture symbols are [finns]
larmknapp som är visuellt markerad [finns] | visually marked button for emergency alarm is [finns]
ledstråket har en ljushetskontrast på [m] mot underlaget | the floor trail to the entrance has [m]
ledstråkets ljushetskontrast är [m] mot underlag | the lightness contrast of the marked trail is [m] against its background
ledstänger finns på höger och vänster sida [x] | there are handrails on both the right and the left hand sides
ledstång placerad på samma sida som manöverpanelen [finns] | handrail is [finns] on the same side as the control panel
ledstång som löper oavbrutet [finns] | handrail that runs continuously is [finns]
ledstång som slutar tvärt vid nedersta delen [finns] | handrail that ends abruptly at the lower part is [finns]
ledstång som slutar tvärt vid nedersta delen [finns] | handrail that ends abruptly at the lower part is [finns]
ledstång som slutar tvärt vid översta delen [finns] | handrail that ends abruptly at the top part is [finns]
ledstången [x] slutar innan översta delen | the handrail ends [x] before the top part
ledstången har en ljushetskontrast på [m] | the handrail has a lightness contrast of [m]
ledstången slutar [m] innan nedersta delen | handrail stops [m] before the bottom end
ledstången slutar [m] innan nedersta trappsteget | handrail stops [m] before the bottom end
ledstången slutar [m] innan rampen tar slut | the handrail ends [m] before the bottom end of the ramp
ledstången slutar [m] innan rampen tar slut | handrail stops [m] before the bottom end of the ramp
ledstången slutar [m] innan översta delen | the handrail ends [m] before the top part
ledstången slutar [m] innan översta delen | the handrail ends [m] before the top part
ledstången sträcker sig [m] förbi nedersta delen | the handrail extends [m] past the part
ledstången sträcker sig [m] förbi översta delen | the handrail extends [m] past the part
ledstången är [m] ovanför golvet | the handrail is [m] above the floor
ledstångens diameter är [m] | the handrail diameter is [m]
ledstångens höjd är [m] | the height of the handrail is [m]
ledstångens kontrast är [m] mot bakgrund | the lightness contrast of the handrail is [m] against the background
ledstångens ljushetskontrast är [m] | the brightness contrast of the handrail is [m]
lekaktiviteter som finns på lekplatsen : [list] | activities available on the playground: [list]
lekaktiviteter som har tillgängliga och användbara alternativ [list] | playground activities with accessible and usable alternatives: [list]
lekhörna [finns] | play area is [finns]
lekplatsentréns fria passagebredd är [m] | free passage width of playground entrance is [m]
lekplatsentréns ljushetskontrast mot omgivande yta är [m] | lightness contrast of playground entrance against surroundings is [m]
lekredskap som går att komma nära intill [finns] | there is [finns] playground equipment that is going to come close to
ljuddämpande avskärmning [finns] | noise reducing shield is [finns]
ljudet får en [a] efterklang | the sound has a [a] lingering note
ljudet har [a] efterklang | the sound lingers for a [a] time
ljudisolerade åskådarutrymmen med högtalare för ingående ljud [finns] | soundproofed audience rooms, with loudspeakers for incoming sound, are [finns]
ljudmiljön är [b] | the sound environment is [b]
ljushetskontrast mellan markeringens färger är [m] | the lightness contrast between the colours of the marking is [m]
ljushetskontrast mot annan dörrmarkering är [m] | the brightness contrast against other door marking is [m]
ljushetskontrast på hyllmärkning är [m] | the lightness contrast of the shelf marking is [m]
ljushetskontrast på inslaget pris är [m] | lightness contrast of the registered price is [m]
ljushetskontrast på texten på displayen är [m] mot bakgrunden | the lightness contrast of the text on the display is [m] against the background
ljushetskontrasten där du ställer fram koppen eller hämtar den , är [m] mot bakgrunden | the lightness contrast of where you place or collect the cup is [m] against its background
ljushetskontrasten på den övre markeringen av dörren är [m] | the brightness contrast of the upper door marking is [m]
ljushetskontrasten på kanten vid rulltrappans nedre del är [m] mot bakgrunden | the lightness contrast of the edge at the beginning of the escalator is [m] against the background
ljushetskontrasten på kanten vid rulltrappans övre del är [m] mot bakgrunden | the lightness contrast of the edge at the end of the escalator is [m] against the background
ljushetskontrasten på ledstråket till påstigningsplatsen är [m] mot bakgrunden | the lightness contrast of the trail to the boarding place is [m] against the background
ljushetskontrasten är [m] mot omgivande ytor | lightness contrast is [m] against surrounding surfaces
luckans underkant är [m] från golv | the lower edge of the door is [m] from the floor
lutning i sidled är [m] | the sideways tilt is [m]
lutningen i längsriktning är [m] | the lengthways tilt is [m]
lutningen längsled på svängrumsytan efter grinden är [m] | the turning space behind the gate tilts lengthways [m]
lutningen längsled på svängrumsytan före grinden är [m] | the tilt lengthways on the turning space in front of the gate is [m]
lutningen på bredden på den fria ytan intill sittplatsen är [m] | the slope of the width of the free surface next to the seating position is [m]
lutningen på längden av den fria ytan intill är [m] | the free space tilts [m] lengthways
lutningen på rampen är [m] lång | the tilt of the ramp is [m] long
lutningen på tröskelns avfasning är [m] | the tilt of the bevelling of the threshold is [m]
lutningen sidled på svängrumsytan efter grinden är [m] | the sideways tilt on the turning space behind the gate is [m]
lutningen sidled på svängrumsytan före grind [m] | the tilt sideways on the turning space in front of the gate is [m]
lutningens bredd är [m] | the width of the tilt is [m]
lutningens längd är [m] | the length of the tilt is [m]
lutningens sträckning är [b] | the length of the slope is [b]
lyftanordning finns [finns] | mobile lifting device is [finns] on request
lyftanordningen är [b] | the lifting device is [b]
lägre nödlarm på vägg är placerat [m] från golv | lower emergency alarm on the wall is placed [m] from the floor
lägre sittplats [finns] | there [finns] lower seating
lägsta arbetshöjd på nedsänkt diskho är [m] | the lowest reachable height of lowered sink is [m]
lägsta del på stödhandtag är placerat [m] från underlag | the lowest part of the grab rail is placed [m] from the ground
lägsta fria höjd under arbetsbänken är [m] | the lowest height of the space under the work surface is [m]
lägsta fria höjd under diskhon är [m] | the lowest free height under the sink is [m]
lägsta funktionen är [m] från underlaget | the height of the lowest placed function is [m] above ground
lägsta hyllan är placerad [m] från underlag | the lowest shelf is placed [m] from the ground
lägsta höjd att nå för att välja dryck är [m] över underlaget | the lowest height to reach for selecting a drink is [m] above ground
lägsta höjd avåkningsskyddet är [m] | the lowest height of the safety edge is [m]
lägsta höjd på höj- och sänkbar spishäll är [m] | the lowest height of the adjustable hob is [m]
lägsta höjd på höj- och sänkbara bordet är [m] | the lowest height of the adjustable table is [m]
lägsta höjd på lekredskap är [m] | lowest height of playground equipment is [m]
lägsta höjd på nedsänkt arbetsbänk är [m] | the lowest possible height of a lowered work surface is [m]
lägsta höjd på nedsänkt behandlingsbänk är [m] | the lowest height of a lowered treatment bench is [m]
lägsta höjd på nedsänkt brits är [m] | lowest height of lowered gurney is [m]
lägsta höjd på nedsänkt säng är [m] | the lowest height of a lowered bed is [m]
lägsta höjden på funktionerna är [m] | the lowest height of functions is [m]
lägsta höjden på kortläsaren är [m] | the lowest height of the card reader is [m]
lägsta höjden på receptionsdisken är [m] | the lowest height of the reception counter is [m]
lägsta markerade djup är [m] | the lowest marked depth is [m]
lägsta sitthöjd är [m] | the lowest seating height is [m]
lägsta sopinkastet är placerat [m] från underlaget | the lowest rubbish chute is placed [m] from the ground
längd på stödhandtag är [m] | the length of the support handle is [m]
längden på backens alternativa gångväg är [m] | the length of the slopes alternative footpath is [m]
längden på den fria ytan framför bollmaskin är [m] | the length of the free space in front of the ball dispenser is [m]
längden på den fria ytan intill sittplatsen är [m] | the length of the free surface next to the seating is [m]
längden på den lägsta delen av den höj- och sänkbara disken är [m] | length of the lowest part of the height-adjustable counter [m]
längden på den lägsta delen av disken är [m] | length of the lowest part of the counter [m]
längden på den totala golvytan är [m] | the length of the total floor space is [m]
längden på disken är [m] | the length of the counter is [m]
längden på draghandtaget är [m] | the length of the pulling handle is [m]
längden på svängrumsytan efter grinden är [m] | the length of the turning space behind the gate is [m]
längden på ytan lutar [c] | the length of the space tilts [c]
längden är [m] | the length is [m]
läsbar information [finns] som komplement till högtalarinformationen | readable information is [finns] which complements the information given through loudspeakers
läsplatta vid receptionsdisk [finns] | readingtablet at reception is [finns]
lättbegripliga instruktioner [finns] | instructions that are easy to understand are [finns]
lås som kan öppnas och stängas med en enda handrörelse [finns] | lock which can be opened and closed with a single hand motion is [finns]
lås som kan öppnas och stängas med en handrörelse [finns] | lock which can be opened and closed by a hand motion [finns]
låsbara hjul [finns] på sittplatsen | lockable wheels are [finns] on the chairr
låsbart klädskåp [finns] | lockable clothes cupboard [finns]
låset är placerat [m] från golvet | the lock is placed [m] above the floor
madrass av polyester [finns] | matress made of polyester are [finns]
madrass med tagel renat från protein [finns] | matress made of horsehair cleansed of protein are [finns]
manöverdonet innanför dörren har en ljushetskontrast på [m] | the manoeuvering tool inside the door has a lightness contrast of [m]
manöverdonet innanför dörren är placerat [m] från närmaste hinder | the manoeuvering tool inside the door is placed [m] from the nearest obstacle
manöverdonet innanför dörren är placerat [m] över underlaget | the manoeuvering tool inside the door is placed [m] above the floor
manöverdonet utanför dörren har en ljushetskontrast på [m] | the manoeuvering tool outside the door has a lightness contrast of [m]
manöverdonet utanför dörren är placerat [m] från närmaste hinder | the manoeuvering tool outside the door is placed [m] from the nearest obstacle
manöverdonet utanför dörren är placerat [m] över underlaget | the manoeuvering tool outside the door is placed [m] above the floor
manöverdonet är placerad [m] över golvet | the manoeuvering tool is placed [m] above the floor
manöverdonet är placerat [m] från närmaste hinder | the manoeuvering tool is placed [m] from the nearest obstacle
manöverpanelen är [b] | the manoeuvering panel is [b] from the wall
markering av ruta på marken [x] | marking of parking space on the ground is [x]
markering vid ledstångens slut nedtill [x] | a marking at the end of the handrail on the lower part is [x]
markering vid ledstångens slut nertill [x] | a marking at the end of the handrail on the lower part is [x]
markering vid ledstångens slut nertill [x] | a marking at the end of the handrail on the lower part is [x]
markering är [b] | the marking is [b]
markeringen har en ljushetskontrast på [m] mot bakgrunden | the marking has a lightness contrast of [m] against the background
markeringen nedtill av fribärande trappan har en ljushetkontrast på [m] | the lower marking of the unsupported staircase has a brightness contrast of [m]
markeringen på sopkärlet har [m] i ljushetskontrast | the marking on the bin has a brightness contrast of [m]
markeringen är [b] | the marking is [b]
markeringen är placerad [m] över golv | the marking is placed [m] above the floor
markeringens andra färg är [b] | the other colour of the marking is [b]
markeringens färg är [b] | the colour of the marking is [b]
markeringens underkant är placerad [m] över underlaget | the lower edge of the marking is placed [m] above the ground
markeringens överkant är placerad [m] över underlaget | the upper edge of the marking i placed [m] above the ground
marksymbol [finns] | ground symbol is [finns]
maten hanteras [finns] | the food is handled [finns]
materialet är anpassat för åldrarna [x] | material for ages [x]
maträtter som kan komponeras efter gästens önskemål vid allergi [finns] | dishes that can be put together according to the guest’s wishes in cases of allergy are [finns]
maträtter som visas på bild [finns] | dishes shown in pictures are [finns]
matsedeln har [objekt] | the menu has [objekt]
matsedelns textstorlek är [b] | the character size on the menu is [b]
maxdjupet är [m] | the maximum depth is [m]
mellan sittplatsen och entrén är avståndet [m] | the distance between the seat and the entrance is [m]
mikrovågsugnens centrum är [m] över golvet | the centre of the microwave oven is [m] above the floor
mikrovågsugnens reglage har ljushetskontrast [m] mot bakgrund | the microwave oven controls have a brightness contrast of [m] against background
minsta bredd för vändmöjlighet inklusive gångvägen är [m] | the lowest width for turning around inclusive of pedestrian area is [m]
minsta bredd för vändmöjlighet inklusive gångyta är [m] | the turn-around space is at least [m] wide including walking area
minsta djupet är [m] | the minimum depth is [m]
minsta textstorlek på hyllmärkning är [m] | the smallest text size of shelf marking is [m]
monitorns funktioner är placerade [m] från underlag | the functions of the monitor are placed [m] from the ground
myntinkastet är placerat [m] från närmaste hörn | the coin slot is placed [m] from the nearest corner
myntinkastet är placerat [m] från underlaget | the coin slot is placed [m] from the ground
möjlighet att betala med kontanter [finns] | possibility to pay with cash [finns]
möjlighet att hålla förbi infästningar [finns] | handrail possible to hold on past the mounting brackets is [finns] here
möjlighet att nå basvaror utan att passera starkt doftande varor [finns] | ability to reach staple commodities without passing strong smelling items is [finns]
möjlighet att nå kassor utan att passera starkt doftande varor [finns] | ability to reach check-outs without passing strong smelling items is [finns]
möjlighet att ta tvål med en hand [finns] | soap dispenser using one hand is [finns]
möjlighet att välja teckenstorlek på informationen [finns] | possible to choose information font size [finns]
nedersta knappraden är placerad [m] från golv | the lower row of buttons is placed [m] from the floor
nedersta trappsteget har en kontrastmarkering på [m] | the bottom step has a contrast marking of [m]
nickel [finns] | nickel is [finns]
nickel [finns] i dörrhandtag | nickel [finns] in door handles
nickel [finns] i knappar | nickel [finns] in buttons
nickel [finns] i ledstänger | nickel [finns] in handrail
nickel [finns] i manöverdon | nickel [finns] in manoeuvering tool
nickel finns i [objekt] | there is nickel in [objekt]
nickel förekommer [i] | nickel can be found [i]
nivåskillnad mellan hissgolv och ytan utanför är [m] när hissen stannat | the difference in level between the lift floor and the area outside is [m] when the lift has stopped
nivåskillnaden mellan väderskyddet och marken utanför är [m] | the difference in level between shelter and ground is [m]
närområdeskarta [finns] | area map [finns]
nästa vändmöjlighet finns om [m] | the next turn-around opportunity will be in [m]
nästa vändmöjlighet på gångvägen finns om [m] | the next turn-around opportunity will be in [m]
nödlarm [finns] placerat vid eller på manöverpanelen | emergency alarm that is placed on or next to the control panel are [finns]
nödlarm eller nödtelefon [finns] som är kopplad till dygnet-runt-bemanning | emergency alarm or emergency telephone, that is connected to staff around-the-clock, is [finns]
nödlarm med tryckknapp på sladd [finns] | emergency alarm with switch on a cord is [finns]
nödlarm på vägg är placerat [m] från golv | emergency alarm on the wall is placed [m] from the floor
nödlarm som går under öppettid till ständigt bemannad reception eller liknande [finns] | emergency alarm which goes to a constantly manned reception, or similar, during opening hours is [finns]
nödlarm som larmar med ljudsignal utanför dörr [finns] | emergency alarm using a sound signal outside the door is [finns]
nödlarm som larmar med ljussignal utanför dörr [finns] | emergency alarm using a light signal outside door is [finns]
nödlarm som testas regelbundet [finns] | emergency alarm which is tested regularly is [finns]
nödlarmet har [objekt] | the emergency alarm has [objekt]
nötter i lösvikt [finns] | loose nuts are [finns]
ombud för [finns] | representative of [finns]
orienteringstavlan har [objekt] | the orientation sign has additional signage with [objekt]
pall för barn [finns] | a stool for children is [finns]
passagebredd vid kassan är [m] | the width of the space by the check-out is [m]
passagebredden genom vändkorset är [m] | the passage through the turnstile is [m] wide
passagetiden är [t] | the passage time is [t]
passageöppningens fria bredd är [m] | the gateway is [m] wide
passageöppningens kanter har en ljushetskontrast på [m] mot omgivande yta | lightness contrast sides of gateway against surrounding surfaces is [m]
personal [finns] på plats | staff is [finns] on site
personal [finns] som har kunskap om befintliga hjälpmedel och utrustning , samt hur den används | staff that have knowledge regarding existing aids and equipment, and how they are used, is [finns]
personal [finns] som har kunskap om den hörseltekniska utrustningen | staff with knowledge of how to use the hearing equipment is [finns]
personal på plats som kan tecken som stöd [finns] | staff on-site who know signing as support is [finns]
personal på plats som kan teckenspråk [finns] | staff is [finns] on-site who know sign language
personal som har instruktion för åtgärd vid nödlarm [finns] | staff who have instructions for action in case of emergency are [finns]
personlig service [finns] vid beställning | personal service is [finns] on request
personlyften är [b] | the person lift is [b]
podiets kant har ljushetkontrast [m] | the edge of the podium has a brightness contrast of [m]
podium [finns] i nivå med golv | podium which is level with floor are [finns]
pollare intill övergångsställe [finns] | bollard next to pedestrian crossing are [finns]
porttelefonen är placerad [m] från närmaste hinder | entryphone is placed [m] from nearest obstacle
porttelefonens funktioner är placerade [m] från marken | the entryphone functions are placed [m] from the ground
porttelefonens ljushetskontrast mot bakgrund är [m] | the brightness contrast of the entryphone against the background is [m]
på [objekt] finns skyddsräcke på bryggan | on the jetty, there is a safety rail on the [objekt]
på gångvägen [finns] en ränndal som inte är övertäckt | uncovered gutter [finns]
på gångvägen [finns] en sittplats | there are [finns] seating
på gångvägen [finns] möjlighet att vända | turn-around opportunity is [finns]
på gångvägen [finns] mötesplats med skymd sikt | meeting point where the view is obstructed is [finns]
på gångvägen [finns] utskjutande föremål | there are [finns] protruding objects
på gångvägen finns [objekt] | there is [objekt]
ramp [finns] som kompenserar den här trappan | ramp is [finns] as a compensation to this staircase
ramp som leder upp på sandlådebordet [finns] | a ramp leading up onto the elevated sandbox is [finns]
rampen lutar [c] | the ramp tilts [c] lengthways
rampen lutar [c] i sidled | the ramp tilts [c] sideways
rampen lutar [c] på längden | the ramp tilts [c] lengthways
rampen är [m] bred | the ramp is [m] wide
rampens avåkningsskydd är en [n] | the type of safety edge on the left hand side of the ramp is [n]
rampens brädor är [b] | the boards of the ramp are [b]
rampens nedersta del har en kontrastmarkering på [m] | the lower part of the ramp has a contrast marking of [m]
rampens underlag är [b] | the surface of the ramp is [b]
rampens översta del har en kontrastmarkering på [m] | the upper part of the ramp has a contrast marking of [m]
redskap [finns] som är lätta att lyfta | equipment that is easy to lift is [finns]
redskap är placerade [m] från underlag | tools are placed [m] from the ground
redskapsstället har [objekt] ljushetskontrast mot bakgrund | the tool stand has [objekt] brightness contrast against the background
regelbunden kontroll av den hörseltekniska utrustningens funktion [finns] | regular controls of the functionality of the hearing equipment are [finns]
reglage på spishäll är [b] | the controls on the hob are [b]
reglagen har ljushetskontrast [m] mot bakgrund | the controls have a brightness contrast of [m] against background
relief [finns] på skylten | sign is [finns] in relief
reliefmarkeringen är [x] | the relief marking is [x]
reliefmarkeringens ljushetskontrast är [m] mot bakgrunden | the lightness contrast of the relief marking is [m] against its background
ringklockan är [b] | the bell is [b]
ringklockan är placerad [m] från närmaste föremål | the bell is placed [m] from the nearest object
ringklockan är placerad [m] över underlaget | the bell is placed [m] above the ground
ringklockans ljushetskontrast mot bakgrunden är [m] | the lightness contrast of the bell is [m] against the background
rullstolsplatser [finns] fördelade i lokalen | wheelchair spaces is [finns] distributed in the space
rulltrappan kompletteras med [objekt] | the escalator is complemented with [objekt]
rulltrappan rör sig [i] | the escalator moves [i]
rummet städas [nu] gånger per vecka | the room is cleaned [nu] per week
rutiner för tolkning [finns] | rutines for interpreter are [finns]
räcke på sidan fram till platsen för i- och uppstigning [finns] | handrail on the side leading to the point where you get into or out of the boat or water is [finns]
räfflade brädor på rampen [finns] | grooved boards on the ramp is [finns]
ränndal som inte är övertäckt [finns] | uncovered gutter [finns]
rökning i rummet är [b] | smoking in the room is [b]
rökning på balkong [x] | smoking [x] on balcony
rökning på uteplats [x] | smoking [x] on patio
rökplatsen [aer] placerad så att rök kan undvikas i entrén eller byggnaden | a smoking area is [aer] that is placed so that smoke is avoided inside the building and by the entrance
sandlåda på marknivå [finns] | sandbox at ground level is [finns]
separat väntrum för tolk [finns] | seperate space/waiting area for interpreter is [finns]
sidohängd ugnslucka [finns] | side hung oven door is [finns]
sitthöjden på duschstolen är [m] | the seating height of the shower chair is [m]
sitthöjden på toalettstolen är [m] | the seating height of the toilet is [m]
sittplats [finns] intill aktivitet | seat [finns] near the activity
sittplats vid grillplats [finns] | seat [finns] near the barbecue area
sittplats är [b] | seat is [b]
sittplatsen är placerad [x] gångyta eller mötesplats | the seat is located [x] walking surface or passing place
sittring av hårt material [finns] | seat made of a hard material are [finns]
sittytan skjuter ut [m] utanför bordets ben | the seating space protrudes [m] outside the table’s legs
sittytan är [m] bred | the seating area is [m] wide
självbetjäningsdiskens höjd är [m] | the height of the self service counter is [m]
skivans djup är [m] | the shelf is [m] deep
skrapgallret är [b] | the wiping grid is [b]
skydd [x] finns mot solen | protection against sunshine is [x]
skyddande gavlar [finns] | protective sides are [finns]
skylt [finns] placerad bredvid dörr på samma sida som dörrhandtaget | sign is [finns] placed next to door on the same side as the doorhandle
skylt [finns] placerad på dörr | sign are [finns] placed on door
skylt med information om verksamheterna [finns] | sign with information about businesses and activities is [finns]
skylt med symbol [finns] | sign with symbol is [finns]
skylt vid lekplatsens entré med geokoordinater [finns] | sign at playground entrance with geo-coordinates is [finns]
skylt vid lekplatsens entré som har namn på lekplatsen med adress [finns] | sign at playground entrance with the name and address of the playground is [finns]
skylt vid lekplatsentrén med uppgift om ansvarig förvaltning för lekplatsen [finns] | sign at playground entrance with information about department responsible for the playground is [finns]
skyltar [finns] som hänvisar till in- och utgångar till lekplatsområdet | signs for entrances and exits to the playground area are [finns]
